<?xml version="1.0" encoding="UTF-8"?>
<xsd:schema xmlns:xsd="http://www.w3.org/2001/XMLSchema">
	<xsd:element name="priorities">
		<xsd:complexType>
			<xsd:sequence>
				<xsd:element name="priority" type="Priority" minOccurs="4" maxOccurs="unbounded"/>
			</xsd:sequence>
		</xsd:complexType>
	</xsd:element>
	<xsd:complexType name="Priority">
		<xsd:sequence>
			<xsd:element name="name" type="xsd:string"/>
		</xsd:sequence>
		<xsd:attribute name="id" type="xsd:int" use="required"/>
	</xsd:complexType>
</xsd:schema>